2019,11,"OO","SkyWest Airlines Inc.","GJT","Grand Junction, CO: Grand Junction Regional",261.00,29.00,6.98,1.49,11.54,0.00,9.00,3.00,0.00,1676.00,511.00,130.00,423.00,0.00,612.00,
2019,11,"OO","SkyWest Airlines Inc.","GNV","Gainesville, FL: Gainesville Regional",44.00,6.00,2.35,0.00,3.12,0.00,0.53,0.00,0.00,245.00,155.00,0.00,80.00,0.00,10.00,
2019,11,"OO","SkyWest Airlines Inc.","GRB","Green Bay, WI: Green Bay Austin Straubel International",133.00,24.00,5.31,2.43,7.46,0.00,8.80,2.00,2.00,1609.00,320.00,382.00,364.00,0.00,543.00,
2019,11,"OO","SkyWest Airlines Inc.","GRR","Grand Rapids, MI: Gerald R. Ford International",233.00,40.00,13.06,1.58,9.97,0.00,15.38,2.00,0.00,3874.00,1686.00,179.00,402.00,0.00,1607.00,
2019,11,"OO","SkyWest Airlines Inc.","GSO","Greensboro/High Point, NC: Piedmont Triad International",23.00,4.00,1.00,0.57,1.00,0.00,1.43,0.00,0.00,247.00,37.00,63.00,24.00,0.00,123.00,
2019,11,"OO","SkyWest Airlines Inc.","GSP","Greer, SC: Greenville-Spartanburg International",59.00,11.00,2.06,0.00,3.72,0.00,5.22,2.00,1.00,667.00,287.00,0.00,112.00,0.00,268.00,
2019,11,"OO","SkyWest Airlines Inc.","GTF","Great Falls, MT: Great Falls International",140.00,5.00,2.92,0.00,1.08,0.00,1.00,1.00,2.00,217.00,134.00,0.00,26.00,0.00,57.00,
2019,11,"OO","SkyWest Airlines Inc.","GTR","Columbus, MS: Golden Triangle Regional",107.00,5.00,1.55,1.42,0.00,0.00,2.03,0.00,0.00,299.00,147.00,64.00,0.00,0.00,88.00,
2019,11,"OO","SkyWest Airlines Inc.","HIB","Hibbing, MN: Range Regional",50.00,4.00,0.92,0.99,1.09,0.00,1.00,1.00,0.00,814.00,70.00,690.00,35.00,0.00,19.00,
2019,11,"OO","SkyWest Airlines Inc.","HLN","Helena, MT: Helena Regional",105.00,5.00,2.91,0.90,1.09,0.00,0.10,0.00,0.00,275.00,119.00,113.00,31.00,0.00,12.00,
2019,11,"OO","SkyWest Airlines Inc.","HOB","Hobbs, NM: Lea County Regional",89.00,19.00,4.56,0.00,5.91,0.00,8.53,1.00,0.00,866.00,186.00,0.00,209.00,0.00,471.00,
2019,11,"OO","SkyWest Airlines Inc.","HOU","Houston, TX: William P Hobby",9.00,1.00,1.00,0.00,0.00,0.00,0.00,0.00,0.00,45.00,45.00,0.00,0.00,0.00,0.00,
2019,11,"OO","SkyWest Airlines Inc.","HPN","White Plains, NY: Westchester County",180.00,23.00,9.18,0.17,5.74,0.00,7.91,3.00,0.00,1924.00,908.00,32.00,235.00,0.00,749.00,
2019,11,"OO","SkyWest Airlines Inc.","HSV","Huntsville, AL: Huntsville International-Carl T Jones Field",101.00,19.00,6.62,0.00,4.98,0.00,7.39,3.00,0.00,2194.00,1430.00,0.00,194.00,0.00,570.00,
2019,11,"OO","SkyWest Airlines Inc.","HYS","Hays, KS: Hays Regional",100.00,25.00,6.50,0.00,12.71,0.00,5.79,5.00,1.00,1914.00,951.00,0.00,470.00,0.00,493.00,
2019,11,"OO","SkyWest Airlines Inc.","IAD","Washington, DC: Washington Dulles International",397.00,70.00,22.90,0.77,18.41,0.00,27.92,6.00,1.00,7294.00,4187.00,23.00,625.00,0.00,2459.00,
2019,11,"OO","SkyWest Airlines Inc.","IAH","Houston, TX: George Bush Intercontinental/Houston",1196.00,191.00,42.75,4.22,70.83,0.18,73.01,11.00,2.00,14178.00,4883.00,202.00,3251.00,5.00,5837.00,
2019,11,"OO","SkyWest Airlines Inc.","ICT","Wichita, KS: Wichita Dwight D Eisenhower National",200.00,38.00,8.37,1.86,17.02,0.00,10.74,1.00,0.00,1838.00,574.00,72.00,523.00,0.00,669.00,
2019,11,"OO","SkyWest Airlines Inc.","IDA","Idaho Falls, ID: Idaho Falls Regional",117.00,10.00,5.13,0.32,2.20,0.00,2.35,1.00,0.00,632.00,456.00,7.00,70.00,0.00,99.00,
2019,11,"OO","SkyWest Airlines Inc.","ILM","Wilmington, NC: Wilmington International",110.00,13.00,4.51,0.00,2.54,0.00,5.95,0.00,4.00,739.00,357.00,0.00,47.00,0.00,335.00,
2019,11,"OO","SkyWest Airlines Inc.","IMT","Iron Mountain/Kingsfd, MI: Ford",55.00,5.00,1.00,0.00,2.37,0.00,1.63,0.00,1.00,161.00,16.00,0.00,76.00,0.00,69.00,
2019,11,"OO","SkyWest Airlines Inc.","IND","Indianapolis, IN: Indianapolis International",100.00,12.00,4.15,0.00,4.69,0.00,3.16,3.00,0.00,783.00,396.00,0.00,177.00,0.00,210.00,
2019,11,"OO","SkyWest Airlines Inc.","INL","International Falls, MN: Falls International Einarson Field",49.00,3.00,1.00,0.33,0.20,0.00,1.47,0.00,0.00,151.00,42.00,29.00,17.00,0.00,63.00,
2019,11,"OO","SkyWest Airlines Inc.","ITH","Ithaca/Cortland, NY: Ithaca Tompkins Regional",83.00,19.00,10.65,0.00,1.22,0.00,7.13,0.00,0.00,1556.00,669.00,0.00,88.00,0.00,799.00,
2019,11,"OO","SkyWest Airlines Inc.","JAC","Jackson, WY: Jackson Hole",20.00,2.00,0.00,1.00,0.00,0.00,1.00,1.00,0.00,64.00,0.00,47.00,0.00,0.00,17.00,
2019,11,"OO","SkyWest Airlines Inc.","JAN","Jackson/Vicksburg, MS: Jackson Medgar Wiley Evers International",36.00,6.00,1.89,0.00,1.81,0.00,2.30,0.00,0.00,256.00,101.00,0.00,61.00,0.00,94.00,
2019,11,"OO","SkyWest Airlines Inc.","JAX","Jacksonville, FL: Jacksonville International",1.00,1.00,0.00,0.00,0.00,0.00,1.00,0.00,0.00,265.00,0.00,0.00,0.00,0.00,265.00,
2019,11,"OO","SkyWest Airlines Inc.","JFK","New York, NY: John F. Kennedy International",275.00,34.00,10.74,1.23,9.20,0.00,12.83,2.00,0.00,2513.00,731.00,60.00,445.00,0.00,1277.00,
2019,11,"OO","SkyWest Airlines Inc.","JMS","Jamestown, ND: Jamestown Regional",81.00,17.00,7.41,0.95,4.73,0.00,3.91,6.00,1.00,1410.00,639.00,113.00,143.00,0.00,515.00,
2019,11,"OO","SkyWest Airlines Inc.","LAN","Lansing, MI: Capital Region International",42.00,7.00,3.31,0.10,0.85,0.00,2.74,1.00,0.00,349.00,197.00,3.00,16.00,0.00,133.00,
2019,11,"OO","SkyWest Airlines Inc.","LAR","Laramie, WY: Laramie Regional",51.00,13.00,3.29,1.00,2.18,0.00,6.53,5.00,1.00,1148.00,134.00,669.00,73.00,0.00,272.00,
2019,11,"OO","SkyWest Airlines Inc.","LAS","Las Vegas, NV: McCarran International",218.00,34.00,1.81,1.17,12.20,0.00,18.82,1.00,0.00,2481.00,362.00,51.00,492.00,0.00,1576.00,
2019,11,"OO","SkyWest Airlines Inc.","LAW","Lawton/Fort Sill, OK: Lawton-Fort Sill Regional",42.00,6.00,2.93,0.00,1.07,0.00,2.00,0.00,0.00,387.00,277.00,0.00,40.00,0.00,70.00,
2019,11,"OO","SkyWest Airlines Inc.","LAX","Los Angeles, CA: Los Angeles International",2725.00,323.00,76.15,9.17,104.88,0.05,132.76,47.00,1.00,23844.00,9136.00,755.00,4131.00,1.00,9821.00,
2019,11,"OO","SkyWest Airlines Inc.","LBB","Lubbock, TX: Lubbock Preston Smith International",112.00,23.00,5.37,0.00,8.72,0.00,8.92,3.00,0.00,1728.00,187.00,0.00,314.00,0.00,1227.00,
2019,11,"OO","SkyWest Airlines Inc.","LBF","North Platte, NE: North Platte Regional Airport Lee Bird Field",51.00,6.00,1.00,0.00,3.00,0.00,2.00,6.00,0.00,232.00,92.00,0.00,66.00,0.00,74.00,
2019,11,"OO","SkyWest Airlines Inc.","LBL","Liberal, KS: Liberal Mid-America Regional",50.00,12.00,1.89,0.00,3.47,0.00,6.64,3.00,0.00,608.00,162.00,0.00,125.00,0.00,321.00,
2019,11,"OO","SkyWest Airlines Inc.","LEX","Lexington, KY: Blue Grass",60.00,9.00,3.36,0.00,1.35,0.00,4.29,0.00,0.00,954.00,717.00,0.00,73.00,0.00,164.00,
2019,11,"OO","SkyWest Airlines Inc.","LGA","New York, NY: LaGuardia",689.00,114.00,26.77,4.91,49.53,0.00,32.79,3.00,2.00,11814.00,5174.00,502.00,2618.00,0.00,3520.00,
2019,11,"OO","SkyWest Airlines Inc.","LGB","Long Beach, CA: Long Beach Airport",186.00,26.00,7.50,2.69,8.25,0.00,7.57,1.00,0.00,3242.00,584.00,1515.00,319.00,0.00,824.00,
2019,11,"OO","SkyWest Airlines Inc.","LIT","Little Rock, AR: Bill and Hillary Clinton Nat Adams Field",132.00,20.00,7.82,0.33,6.46,0.00,5.38,1.00,0.00,1136.00,310.00,6.00,588.00,0.00,232.00,
2019,11,"OO","SkyWest Airlines Inc.","LNK","Lincoln, NE: Lincoln Airport",176.00,29.00,4.42,2.29,13.28,0.00,9.00,2.00,0.00,1632.00,366.00,144.00,369.00,0.00,753.00,
2019,11,"OO","SkyWest Airlines Inc.","LRD","Laredo, TX: Laredo International",60.00,6.00,0.95,0.72,1.42,0.00,2.91,0.00,0.00,118.00,19.00,13.00,27.00,0.00,59.00,
2019,11,"OO","SkyWest Airlines Inc.","LSE","La Crosse, WI: La Crosse Regional",146.00,25.00,9.09,1.00,10.59,0.00,4.32,1.00,0.00,1133.00,457.00,23.00,373.00,0.00,280.00,
2019,11,"OO","SkyWest Airlines Inc.","LWB","Lewisburg, WV: Greenbrier Valley",52.00,7.00,2.72,0.00,0.93,0.00,3.35,1.00,0.00,451.00,135.00,0.00,30.00,0.00,286.00,
2019,11,"OO","SkyWest Airlines Inc.","LWS","Lewiston, ID: Lewiston Nez Perce County",88.00,4.00,1.00,1.75,0.47,0.00,0.78,0.00,5.00,278.00,24.00,104.00,55.00,0.00,95.00,
2019,11,"OO","SkyWest Airlines Inc.","MAF","Midland/Odessa, TX: Midland International Air and Space Port",37.00,6.00,2.00,0.00,2.78,0.00,1.22,1.00,0.00,372.00,262.00,0.00,78.00,0.00,32.00,
2019,11,"OO","SkyWest Airlines Inc.","MBS","Saginaw/Bay City/Midland, MI: MBS International",141.00,20.00,11.73,0.05,5.53,0.00,2.68,4.00,0.00,2706.00,2338.00,4.00,144.00,0.00,220.00,
2019,11,"OO","SkyWest Airlines Inc.","MCI","Kansas City, MO: Kansas City International",248.00,44.00,12.17,1.94,14.34,0.00,15.56,7.00,0.00,2932.00,755.00,593.00,523.00,0.00,1061.00,
2019,11,"OO","SkyWest Airlines Inc.","MDT","Harrisburg, PA: Harrisburg International",32.00,4.00,2.87,0.00,1.13,0.00,0.00,1.00,0.00,287.00,246.00,0.00,41.00,0.00,0.00,
2019,11,"OO","SkyWest Airlines Inc.","MDW","Chicago, IL: Chicago Midway International",249.00,50.00,10.15,5.73,15.66,0.00,18.46,1.00,1.00,2982.00,783.00,459.00,737.00,0.00,1003.00,
2019,11,"OO","SkyWest Airlines Inc.","MEI","Meridian, MS: Key Field",59.00,12.00,3.32,0.00,4.37,0.00,4.31,0.00,0.00,673.00,210.00,0.00,170.00,0.00,293.00,
2019,11,"OO","SkyWest Airlines Inc.","MEM","Memphis, TN: Memphis International",160.00,26.00,11.38,1.53,5.72,0.00,7.37,2.00,0.00,1659.00,898.00,190.00,257.00,0.00,314.00,
2019,11,"OO","SkyWest Airlines Inc.","MFE","Mission/McAllen/Edinburg, TX: McAllen Miller International",8.00,2.00,1.79,0.00,0.06,0.00,0.15,0.00,0.00,107.00,98.00,0.00,5.00,0.00,4.00,
2019,11,"OO","SkyWest Airlines Inc.","MFR","Medford, OR: Rogue Valley International - Medford",320.00,50.00,19.44,0.00,9.49,0.00,21.08,5.00,0.00,3481.00,1577.00,0.00,312.00,0.00,1592.00,
2019,11,"OO","SkyWest Airlines Inc.","MGM","Montgomery, AL: Montgomery Regional",217.00,21.00,6.77,1.24,4.82,0.00,8.17,0.00,0.00,686.00,216.00,51.00,98.00,0.00,321.00,
2019,11,"OO","SkyWest Airlines Inc.","MHK","Manhattan/Ft. Riley, KS: Manhattan Regional",47.00,5.00,0.25,0.00,3.38,0.00,1.37,0.00,0.00,180.00,4.00,0.00,72.00,0.00,104.00,
2019,11,"OO","SkyWest Airlines Inc.","MHT","Manchester, NH: Manchester-Boston Regional",58.00,8.00,2.76,0.00,2.32,0.00,2.92,1.00,0.00,425.00,205.00,0.00,88.00,0.00,132.00,
2019,11,"OO","SkyWest Airlines Inc.","MKE","Milwaukee, WI: General Mitchell International",409.00,74.00,17.39,0.63,21.81,1.00,33.16,7.00,1.00,5074.00,1605.00,130.00,760.00,25.00,2554.00,
2019,11,"OO","SkyWest Airlines Inc.","MKG","Muskegon, MI: Muskegon County",58.00,10.00,6.65,0.00,1.79,0.00,1.56,4.00,0.00,933.00,827.00,0.00,56.00,0.00,50.00,
2019,11,"OO","SkyWest Airlines Inc.","MLI","Moline, IL: Quad City International",120.00,21.00,6.63,0.00,6.03,0.00,8.34,2.00,0.00,1997.00,1013.00,0.00,231.00,0.00,753.00,
2019,11,"OO","SkyWest Airlines Inc.","MLU","Monroe, LA: Monroe Regional",146.00,18.00,7.20,0.40,2.39,0.00,8.01,0.00,0.00,869.00,426.00,35.00,75.00,0.00,333.00,
2019,11,"OO","SkyWest Airlines Inc.","MMH","Mammoth Lakes, CA: Mammoth Lakes Airport",29.00,6.00,0.96,0.00,0.04,0.00,5.00,3.00,0.00,436.00,219.00,0.00,9.00,0.00,208.00,
2019,11,"OO","SkyWest Airlines Inc.","MOB","Mobile, AL: Mobile Regional",156.00,17.00,4.90,4.05,2.04,0.00,6.02,0.00,0.00,942.00,215.00,218.00,58.00,0.00,451.00,
2019,11,"OO","SkyWest Airlines Inc.","MOT","Minot, ND: Minot International",160.00,21.00,4.68,1.09,3.86,0.00,11.37,3.00,4.00,1675.00,178.00,664.00,161.00,0.00,672.00,
2019,11,"OO","SkyWest Airlines Inc.","MQT","Marquette, MI: Sawyer International",83.00,12.00,6.03,1.00,1.35,0.00,3.63,5.00,1.00,1530.00,356.00,856.00,60.00,0.00,258.00,
2019,11,"OO","SkyWest Airlines Inc.","MRY","Monterey, CA: Monterey Regional",208.00,28.00,10.64,0.00,5.23,0.00,12.13,5.00,4.00,1587.00,786.00,0.00,178.00,0.00,623.00,
2019,11,"OO","SkyWest Airlines Inc.","MSN","Madison, WI: Dane County Regional-Truax Field",292.00,43.00,14.64,2.25,15.00,0.00,11.12,3.00,0.00,3154.00,894.00,304.00,523.00,0.00,1433.00,
2019,11,"OO","SkyWest Airlines Inc.","MSO","Missoula, MT: Missoula International",136.00,15.00,7.10,1.00,3.82,0.00,3.08,1.00,1.00,1395.00,436.00,734.00,96.00,0.00,129.00,
2019,11,"OO","SkyWest Airlines Inc.","MSP","Minneapolis, MN: Minneapolis-St Paul International",3307.00,472.00,92.08,48.76,143.31,3.39,184.46,23.00,6.00,41846.00,13440.00,10001.00,6012.00,87.00,12306.00,
2019,11,"OO","SkyWest Airlines Inc.","MSY","New Orleans, LA: Louis Armstrong New Orleans International",8.00,2.00,1.00,0.00,1.00,0.00,0.00,0.00,0.00,48.00,31.00,0.00,17.00,0.00,0.00,
2019,11,"OO","SkyWest Airlines Inc.","MTJ","Montrose/Delta, CO: Montrose Regional",86.00,15.00,7.10,0.00,5.10,0.00,2.79,3.00,0.00,715.00,301.00,0.00,114.00,0.00,300.00,
2019,11,"OO","SkyWest Airlines Inc.","OAK","Oakland, CA: Metropolitan Oakland International",59.00,4.00,1.00,0.00,2.00,0.00,1.00,0.00,0.00,208.00,141.00,0.00,33.00,0.00,34.00,
2019,11,"OO","SkyWest Airlines Inc.","OGS","Ogdensburg, NY: Ogdensburg International",51.00,7.00,4.78,0.00,0.01,0.00,2.21,3.00,2.00,567.00,461.00,0.00,1.00,0.00,105.00,
2019,11,"OO","SkyWest Airlines Inc.","OKC","Oklahoma City, OK: Will Rogers World",441.00,73.00,13.76,0.30,35.35,0.00,23.59,6.00,1.00,4379.00,959.00,19.00,1089.00,0.00,2312.00,
2019,11,"OO","SkyWest Airlines Inc.","OMA","Omaha, NE: Eppley Airfield",446.00,77.00,23.84,2.00,26.52,0.00,24.64,6.00,1.00,4319.00,1395.00,175.00,1051.00,0.00,1698.00,
2019,11,"OO","SkyWest Airlines Inc.","ONT","Ontario, CA: Ontario International",168.00,30.00,9.58,1.90,2.59,0.00,15.93,3.00,1.00,2592.00,1040.00,105.00,121.00,0.00,1326.00,
2019,11,"OO","SkyWest Airlines Inc.","ORD","Chicago, IL: Chicago O'Hare International",5094.00,796.00,183.98,19.32,297.30,1.17,294.23,142.00,11.00,83382.00,31782.00,4457.00,22157.00,21.00,24965.00,
2019,11,"OO","SkyWest Airlines Inc.","ORF","Norfolk, VA: Norfolk International",128.00,22.00,7.40,1.05,10.78,0.00,2.76,2.00,0.00,1008.00,372.00,117.00,368.00,0.00,151.00,
2019,11,"OO","SkyWest Airlines Inc.","ORH","Worcester, MA: Worcester Regional",29.00,2.00,1.50,0.00,0.50,0.00,0.00,1.00,0.00,78.00,70.00,0.00,8.00,0.00,0.00,
2019,11,"OO","SkyWest Airlines Inc.","OTH","North Bend/Coos Bay, OR: Southwest Oregon Regional",20.00,3.00,0.98,0.72,0.00,0.00,1.30,0.00,2.00,264.00,52.00,84.00,0.00,0.00,128.00,
2019,11,"OO","SkyWest Airlines Inc.","PAE","Everett, WA: Snohomish County",174.00,26.00,6.24,0.00,9.12,0.00,10.64,7.00,3.00,920.00,269.00,0.00,293.00,0.00,358.00,
2019,11,"OO","SkyWest Airlines Inc.","PAH","Paducah, KY: Barkley Regional",110.00,20.00,5.00,0.00,8.96,0.00,6.04,4.00,0.00,1016.00,450.00,0.00,212.00,0.00,354.00,
2019,11,"OO","SkyWest Airlines Inc.","PBG","Plattsburgh, NY: Plattsburgh International",52.00,10.00,6.96,0.00,0.54,0.00,2.50,2.00,0.00,2785.00,1844.00,0.00,42.00,0.00,899.00,
2019,11,"OO","SkyWest Airlines Inc.","PDX","Portland, OR: Portland International",853.00,88.00,19.32,6.85,28.94,0.00,32.89,5.00,2.00,6120.00,1114.00,1804.00,747.00,0.00,2455.00,
2019,11,"OO","SkyWest Airlines Inc.","PHL","Philadelphia, PA: Philadelphia International",4.00,1.00,0.00,0.00,0.00,0.00,1.00,0.00,0.00,34.00,0.00,0.00,0.00,0.00,34.00,
2019,11,"OO","SkyWest Airlines Inc.","PHX","Phoenix, AZ: Phoenix Sky Harbor International",1200.00,137.00,32.21,5.05,38.85,1.00,59.89,18.00,2.00,11651.00,4929.00,1181.00,1331.00,140.00,4070.00,
2019,11,"OO","SkyWest Airlines Inc.","PIA","Peoria, IL: General Downing - Peoria International",115.00,8.00,4.20,0.00,2.47,0.00,1.33,1.00,0.00,963.00,801.00,0.00,49.00,0.00,113.00,
2019,11,"OO","SkyWest Airlines Inc.","PIB","Hattiesburg/Laurel, MS: Hattiesburg-Laurel Regional",55.00,5.00,0.64,0.00,0.36,0.00,4.00,0.00,0.00,290.00,70.00,0.00,16.00,0.00,204.00,
2019,11,"OO","SkyWest Airlines Inc.","PIH","Pocatello, ID: Pocatello Regional",87.00,7.00,0.14,0.00,1.81,0.00,5.05,0.00,0.00,435.00,5.00,0.00,112.00,0.00,318.00,
2019,11,"OO","SkyWest Airlines Inc.","PIR","Pierre, SD: Pierre Regional",55.00,9.00,2.92,0.88,2.43,0.00,2.77,6.00,0.00,509.00,181.00,92.00,89.00,0.00,147.00,
2019,11,"OO","SkyWest Airlines Inc.","PIT","Pittsburgh, PA: Pittsburgh International",108.00,7.00,3.00,0.00,1.23,0.00,2.77,1.00,0.00,394.00,225.00,0.00,33.00,0.00,136.00,
2019,11,"OO","SkyWest Airlines Inc.","PLN","Pellston, MI: Pellston Regional Airport of Emmet County",71.00,15.00,1.67,3.56,4.45,0.00,5.32,0.00,3.00,871.00,106.00,376.00,192.00,0.00,197.00,
2019,11,"OO","SkyWest Airlines Inc.","PNS","Pensacola, FL: Pensacola International",5.00,1.00,1.00,0.00,0.00,0.00,0.00,0.00,0.00,98.00,98.00,0.00,0.00,0.00,0.00,
2019,11,"OO","SkyWest Airlines Inc.","PRC","Prescott, AZ: Prescott Regional Ernest A Love Field",62.00,12.00,4.84,0.00,3.10,0.00,4.06,2.00,0.00,666.00,274.00,0.00,75.00,0.00,317.00,
2019,11,"OO","SkyWest Airlines Inc.","PSC","Pasco/Kennewick/Richland, WA: Tri Cities",291.00,40.00,13.44,3.96,8.60,0.00,14.00,7.00,3.00,7588.00,3629.00,2359.00,341.00,0.00,1259.00,
2019,11,"OO","SkyWest Airlines Inc.","PSP","Palm Springs, CA: Palm Springs International",415.00,62.00,21.01,0.83,13.34,0.00,26.82,9.00,2.00,4619.00,2267.00,81.00,397.00,0.00,1874.00,
2019,11,"OO","SkyWest Airlines Inc.","PUB","Pueblo, CO: Pueblo Memorial",76.00,18.00,7.97,0.00,7.00,0.00,3.02,3.00,0.00,1116.00,449.00,0.00,401.00,0.00,266.00,
2019,11,"OO","SkyWest Airlines Inc.","PVD","Providence, RI: Theodore Francis Green State",80.00,17.00,9.08,1.53,2.29,0.00,4.11,1.00,1.00,939.00,458.00,119.00,114.00,0.00,248.00,
2019,11,"OO","SkyWest Airlines Inc.","PWM","Portland, ME: Portland International Jetport",26.00,1.00,0.98,0.00,0.00,0.00,0.02,1.00,0.00,41.00,40.00,0.00,0.00,0.00,1.00,
2019,11,"OO","SkyWest Airlines Inc.","RAP","Rapid City, SD: Rapid City Regional",179.00,20.00,7.14,1.00,6.56,0.00,5.30,9.00,4.00,1090.00,583.00,57.00,222.00,0.00,228.00,
2019,11,"OO","SkyWest Airlines Inc.","RDD","Redding, CA: Redding Municipal",119.00,21.00,7.91,0.00,2.08,0.00,11.01,3.00,0.00,1023.00,316.00,0.00,52.00,0.00,655.00,
2019,11,"OO","SkyWest Airlines Inc.","RDM","Bend/Redmond, OR: Roberts Field",284.00,41.00,17.82,1.00,9.14,0.00,13.04,3.00,0.00,2476.00,1280.00,79.00,267.00,0.00,850.00,
2019,11,"OO","SkyWest Airlines Inc.","RDU","Raleigh/Durham, NC: Raleigh-Durham International",7.00,2.00,0.89,0.00,1.11,0.00,0.00,0.00,0.00,139.00,110.00,0.00,29.00,0.00,0.00,
2019,11,"OO","SkyWest Airlines Inc.","RHI","Rhinelander, WI: Rhinelander/Oneida County",58.00,7.00,2.61,0.05,2.91,0.00,1.43,0.00,0.00,1348.00,1197.00,2.00,95.00,0.00,54.00,
2019,11,"OO","SkyWest Airlines Inc.","RIC","Richmond, VA: Richmond International",152.00,14.00,8.41,0.96,3.54,0.00,1.09,3.00,0.00,1072.00,447.00,355.00,100.00,0.00,170.00,
2019,11,"OO","SkyWest Airlines Inc.","RKS","Rock Springs, WY: Southwest Wyoming Regional",60.00,9.00,1.46,0.00,3.97,0.00,3.57,3.00,1.00,543.00,214.00,0.00,159.00,0.00,170.00,
2019,11,"OO","SkyWest Airlines Inc.","RNO","Reno, NV: Reno/Tahoe International",347.00,39.00,17.54,1.03,6.27,0.00,14.15,3.00,0.00,3024.00,1977.00,51.00,278.00,0.00,718.00,
2019,11,"OO","SkyWest Airlines Inc.","ROA","Roanoke, VA: Roanoke Blacksburg Regional Woodrum Field",54.00,2.00,0.00,0.88,0.00,0.00,1.12,1.00,0.00,158.00,0.00,36.00,0.00,0.00,122.00,
2019,11,"OO","SkyWest Airlines Inc.","ROC","Rochester, NY: Greater Rochester International",153.00,22.00,7.99,2.99,4.77,0.00,6.25,1.00,1.00,1996.00,1178.00,203.00,200.00,0.00,415.00,
2019,11,"OO","SkyWest Airlines Inc.","ROW","Roswell, NM: Roswell International Air Center",117.00,11.00,3.46,0.00,5.02,0.00,2.52,0.00,0.00,436.00,246.00,0.00,135.00,0.00,55.00,
2019,11,"OO","SkyWest Airlines Inc.","RST","Rochester, MN: Rochester International",109.00,18.00,5.93,1.69,3.07,0.00,7.31,1.00,0.00,1487.00,802.00,84.00,110.00,0.00,491.00,
2019,11,"OO","SkyWest Airlines Inc.","SAF","Santa Fe, NM: Santa Fe Municipal",140.00,20.00,3.20,0.74,10.00,0.00,6.06,1.00,2.00,686.00,145.00,14.00,291.00,0.00,236.00,
2019,11,"OO","SkyWest Airlines Inc.","SAN","San Diego, CA: San Diego International",668.00,71.00,14.01,1.86,25.35,0.00,29.77,3.00,1.00,4971.00,1048.00,589.00,1020.00,0.00,2314.00,
2019,11,"OO","SkyWest Airlines Inc.","SAT","San Antonio, TX: San Antonio International",303.00,48.00,9.41,2.18,16.05,0.00,20.35,2.00,2.00,2918.00,672.00,132.00,712.00,0.00,1402.00,
2019,11,"OO","SkyWest Airlines Inc.","SAV","Savannah, GA: Savannah/Hilton Head International",94.00,14.00,4.19,0.00,2.16,0.00,7.65,2.00,0.00,1069.00,286.00,0.00,118.00,0.00,665.00,
2019,11,"OO","SkyWest Airlines Inc.","SBA","Santa Barbara, CA: Santa Barbara Municipal",434.00,67.00,18.98,4.31,12.63,0.00,31.08,3.00,0.00,6743.00,1647.00,2179.00,484.00,0.00,2433.00,
2019,11,"OO","SkyWest Airlines Inc.","SBN","South Bend, IN: South Bend International",444.00,75.00,22.05,7.06,11.55,0.00,34.34,3.00,1.00,6800.00,2557.00,1580.00,629.00,0.00,2034.00,
2019,11,"OO","SkyWest Airlines Inc.","SBP","San Luis Obispo, CA: San Luis County Regional",459.00,79.00,19.32,10.54,16.08,0.00,33.07,24.00,8.00,10548.00,2815.00,3866.00,661.00,0.00,3206.00,
2019,11,"OO","SkyWest Airlines Inc.","SCE","State College, PA: University Park",99.00,19.00,10.00,1.94,0.66,0.00,6.40,2.00,0.00,2184.00,830.00,727.00,52.00,0.00,575.00,
2019,11,"OO","SkyWest Airlines Inc.","SCK","Stockton, CA: Stockton Metropolitan",59.00,6.00,3.00,0.00,1.94,0.00,1.06,0.00,1.00,470.00,321.00,0.00,48.00,0.00,101.00,
2019,11,"OO","SkyWest Airlines Inc.","SDF","Louisville, KY: Louisville Muhammad Ali International",224.00,35.00,9.80,0.96,10.03,0.00,14.20,2.00,0.00,2712.00,1363.00,24.00,377.00,0.00,948.00,
2019,11,"OO","SkyWest Airlines Inc.","SEA","Seattle, WA: Seattle/Tacoma International",988.00,162.00,12.46,10.19,76.65,0.00,62.70,5.00,13.00,15623.00,820.00,2762.00,2866.00,0.00,9175.00,
2019,11,"OO","SkyWest Airlines Inc.","SFO","San Francisco, CA: San Francisco International",3177.00,655.00,90.92,13.00,324.24,0.00,226.84,81.00,11.00,60035.00,16266.00,1918.00,23681.00,0.00,18170.00,
2019,11,"OO","SkyWest Airlines Inc.","SGF","Springfield, MO: Springfield-Branson National",60.00,8.00,2.78,0.00,3.21,0.00,2.00,2.00,0.00,179.00,61.00,0.00,63.00,0.00,55.00,
2019,11,"OO","SkyWest Airlines Inc.","SGU","St. George, UT: St George Regional",322.00,45.00,10.65,0.08,18.12,1.00,15.16,3.00,0.00,2946.00,1120.00,3.00,774.00,35.00,1014.00,
2019,11,"OO","SkyWest Airlines Inc.","SHD","Staunton, VA: Shenandoah Valley Regional",55.00,12.00,5.39,0.00,1.34,0.00,5.27,1.00,0.00,4239.00,2186.00,0.00,27.00,0.00,2026.00,
2019,11,"OO","SkyWest Airlines Inc.","SHV","Shreveport, LA: Shreveport Regional",200.00,27.00,10.33,3.15,5.82,0.00,7.70,1.00,0.00,1195.00,517.00,76.00,251.00,0.00,351.00,
2019,11,"OO","SkyWest Airlines Inc.","SJC","San Jose, CA: Norman Y. Mineta San Jose International",514.00,27.00,10.86,0.00,5.16,0.00,10.98,2.00,2.00,2021.00,1181.00,0.00,145.00,0.00,695.00,
2019,11,"OO","SkyWest Airlines Inc.","SLC","Salt Lake City, UT: Salt Lake City International",3508.00,336.00,65.82,23.60,96.47,0.00,150.11,18.00,3.00,29429.00,8758.00,6153.00,3374.00,0.00,11144.00,
2019,11,"OO","SkyWest Airlines Inc.","SLN","Salina, KS: Salina Regional",75.00,10.00,2.94,0.00,2.00,0.00,5.07,4.00,0.00,558.00,280.00,0.00,77.00,0.00,201.00,
2019,11,"OO","SkyWest Airlines Inc.","SMF","Sacramento, CA: Sacramento International",653.00,70.00,22.49,0.73,10.86,0.00,35.92,2.00,2.00,5604.00,1658.00,61.00,559.00,0.00,3326.00,
2019,11,"OO","SkyWest Airlines Inc.","SNA","Santa Ana, CA: John Wayne Airport-Orange County",397.00,40.00,13.83,0.13,9.31,0.00,16.73,8.00,0.00,2233.00,897.00,2.00,262.00,0.00,1072.00,
2019,11,"OO","SkyWest Airlines Inc.","SPI","Springfield, IL: Abraham Lincoln Capital",82.00,19.00,8.51,0.00,2.19,0.00,8.30,2.00,0.00,1104.00,631.00,0.00,105.00,0.00,368.00,
2019,11,"OO","SkyWest Airlines Inc.","STL","St. Louis, MO: St Louis Lambert International",64.00,9.00,4.73,0.00,1.99,0.00,2.28,3.00,0.00,1300.00,773.00,0.00,80.00,0.00,447.00,
2019,11,"OO","SkyWest Airlines Inc.","STS","Santa Rosa, CA: Charles M. Schulz - Sonoma County",181.00,21.00,6.97,1.51,9.43,0.00,3.09,21.00,0.00,1834.00,1190.00,107.00,430.00,0.00,107.00,
2019,11,"OO","SkyWest Airlines Inc.","SUN","Sun Valley/Hailey/Ketchum, ID: Friedman Memorial",85.00,4.00,1.93,0.00,0.83,0.00,1.24,1.00,7.00,255.00,91.00,0.00,16.00,0.00,148.00,
2019,11,"OO","SkyWest Airlines Inc.","SWF","Newburgh/Poughkeepsie, NY: New York Stewart International",58.00,8.00,3.00,1.56,0.21,0.00,3.23,0.00,0.00,1148.00,214.00,500.00,46.00,0.00,388.00,
2019,11,"OO","SkyWest Airlines Inc.","SYR","Syracuse, NY: Syracuse Hancock International",271.00,50.00,15.56,4.65,14.39,0.00,15.41,4.00,0.00,3408.00,1675.00,269.00,459.00,0.00,1005.00,
2019,11,"OO","SkyWest Airlines Inc.","TRI","Bristol/Johnson City/Kingsport, TN: Tri Cities",107.00,9.00,2.77,2.08,2.06,0.00,2.09,0.00,0.00,306.00,77.00,65.00,55.00,0.00,109.00,
2019,11,"OO","SkyWest Airlines Inc.","TUL","Tulsa, OK: Tulsa International",193.00,36.00,12.74,1.00,13.26,0.00,8.99,1.00,0.00,2084.00,830.00,216.00,446.00,0.00,592.00,
2019,11,"OO","SkyWest Airlines Inc.","TUS","Tucson, AZ: Tucson International",592.00,91.00,27.39,2.63,29.12,1.00,30.86,6.00,0.00,6217.00,2330.00,163.00,1053.00,176.00,2495.00,
2019,11,"OO","SkyWest Airlines Inc.","TVC","Traverse City, MI: Cherry Capital",189.00,34.00,14.85,1.95,6.33,0.00,10.87,3.00,1.00,2139.00,751.00,136.00,289.00,0.00,963.00,
2019,11,"OO","SkyWest Airlines Inc.","TWF","Twin Falls, ID: Joslin Field - Magic Valley Regional",82.00,5.00,2.00,0.29,1.00,0.00,1.71,0.00,0.00,287.00,149.00,5.00,25.00,0.00,108.00,
2019,11,"OO","SkyWest Airlines Inc.","TYS","Knoxville, TN: McGhee Tyson",132.00,25.00,8.14,0.90,8.72,0.00,7.24,1.00,2.00,1171.00,221.00,238.00,331.00,0.00,381.00,
2019,11,"OO","SkyWest Airlines Inc.","UIN","Quincy, IL: Quincy Regional-Baldwin Field",51.00,9.00,3.06,0.00,2.81,0.00,3.13,2.00,0.00,1307.00,1101.00,0.00,68.00,0.00,138.00,
2019,11,"OO","SkyWest Airlines Inc.","VEL","Vernal, UT: Vernal Regional",51.00,10.00,1.91,0.00,2.69,0.00,5.39,3.00,0.00,540.00,148.00,0.00,53.00,0.00,339.00,
2019,11,"OO","SkyWest Airlines Inc.","VLD","Valdosta, GA: Valdosta Regional",85.00,4.00,2.00,0.00,0.00,0.00,2.00,0.00,0.00,185.00,151.00,0.00,0.00,0.00,34.00,
