2019,11,"DL","Delta Air Lines Inc.","PBI","West Palm Beach/Palm Beach, FL: Palm Beach International",428.00,26.00,11.52,0.04,10.19,0.00,4.24,0.00,1.00,1010.00,587.00,1.00,257.00,0.00,165.00,
2019,11,"DL","Delta Air Lines Inc.","PDX","Portland, OR: Portland International",568.00,50.00,21.68,0.35,18.76,0.00,9.20,1.00,0.00,2003.00,1039.00,7.00,647.00,0.00,310.00,
2019,11,"DL","Delta Air Lines Inc.","PHF","Newport News/Williamsburg, VA: Newport News/Williamsburg International",26.00,1.00,0.61,0.00,0.00,0.00,0.39,0.00,0.00,18.00,11.00,0.00,0.00,0.00,7.00,
2019,11,"DL","Delta Air Lines Inc.","PHL","Philadelphia, PA: Philadelphia International",547.00,42.00,19.40,1.67,13.07,0.00,7.86,0.00,0.00,2398.00,924.00,168.00,693.00,0.00,613.00,
2019,11,"DL","Delta Air Lines Inc.","PHX","Phoenix, AZ: Phoenix Sky Harbor International",698.00,108.00,24.72,2.67,64.58,0.00,16.04,0.00,0.00,5321.00,1330.00,926.00,2097.00,0.00,968.00,
2019,11,"DL","Delta Air Lines Inc.","PIT","Pittsburgh, PA: Pittsburgh International",312.00,17.00,8.43,0.05,3.61,0.00,4.91,1.00,0.00,1807.00,1216.00,12.00,114.00,0.00,465.00,
2019,11,"DL","Delta Air Lines Inc.","PNS","Pensacola, FL: Pensacola International",222.00,8.00,2.00,0.00,0.91,0.00,5.09,0.00,0.00,289.00,108.00,0.00,20.00,0.00,161.00,
2019,11,"DL","Delta Air Lines Inc.","PVD","Providence, RI: Theodore Francis Green State",108.00,7.00,4.58,1.70,0.30,0.00,0.42,0.00,0.00,317.00,164.00,109.00,30.00,0.00,14.00,
2019,11,"DL","Delta Air Lines Inc.","PWM","Portland, ME: Portland International Jetport",32.00,5.00,3.68,0.00,0.32,0.00,1.00,0.00,0.00,205.00,173.00,0.00,13.00,0.00,19.00,
2019,11,"DL","Delta Air Lines Inc.","RAP","Rapid City, SD: Rapid City Regional",27.00,4.00,1.00,1.00,1.00,0.00,1.00,1.00,1.00,99.00,46.00,15.00,22.00,0.00,16.00,
2019,11,"DL","Delta Air Lines Inc.","RDU","Raleigh/Durham, NC: Raleigh-Durham International",855.00,83.00,30.57,0.28,25.30,0.00,26.85,0.00,0.00,4898.00,2174.00,50.00,1041.00,0.00,1633.00,
2019,11,"DL","Delta Air Lines Inc.","RIC","Richmond, VA: Richmond International",245.00,9.00,4.59,2.00,1.09,0.00,1.32,0.00,0.00,688.00,364.00,229.00,29.00,0.00,66.00,
2019,11,"DL","Delta Air Lines Inc.","RNO","Reno, NV: Reno/Tahoe International",55.00,1.00,0.00,0.00,0.00,0.00,1.00,0.00,0.00,39.00,0.00,0.00,0.00,0.00,39.00,
2019,11,"DL","Delta Air Lines Inc.","ROA","Roanoke, VA: Roanoke Blacksburg Regional Woodrum Field",24.00,1.00,0.55,0.00,0.00,0.00,0.45,0.00,0.00,40.00,22.00,0.00,0.00,0.00,18.00,
2019,11,"DL","Delta Air Lines Inc.","ROC","Rochester, NY: Greater Rochester International",84.00,11.00,6.53,0.00,0.38,0.00,4.09,0.00,0.00,483.00,326.00,0.00,10.00,0.00,147.00,
2019,11,"DL","Delta Air Lines Inc.","RSW","Fort Myers, FL: Southwest Florida International",435.00,45.00,17.42,0.74,15.40,0.00,11.43,0.00,0.00,2555.00,1222.00,22.00,701.00,0.00,610.00,
2019,11,"DL","Delta Air Lines Inc.","SAN","San Diego, CA: San Diego International",696.00,110.00,39.79,2.21,52.93,0.00,15.07,0.00,5.00,5154.00,2337.00,180.00,1919.00,0.00,718.00,
2019,11,"DL","Delta Air Lines Inc.","SAT","San Antonio, TX: San Antonio International",320.00,31.00,18.30,0.60,7.26,0.00,4.85,0.00,0.00,2680.00,2087.00,54.00,273.00,0.00,266.00,
2019,11,"DL","Delta Air Lines Inc.","SAV","Savannah, GA: Savannah/Hilton Head International",293.00,15.00,8.13,0.00,1.21,0.00,5.66,0.00,0.00,564.00,321.00,0.00,25.00,0.00,218.00,
2019,11,"DL","Delta Air Lines Inc.","SBN","South Bend, IN: South Bend International",2.00,0.00,0.00,0.00,0.00,0.00,0.00,0.00,0.00,0.00,0.00,0.00,0.00,0.00,0.00,
2019,11,"DL","Delta Air Lines Inc.","SDF","Louisville, KY: Louisville Muhammad Ali International",232.00,15.00,7.43,0.99,1.87,0.00,4.71,0.00,0.00,719.00,422.00,90.00,44.00,0.00,163.00,
2019,11,"DL","Delta Air Lines Inc.","SEA","Seattle, WA: Seattle/Tacoma International",2329.00,295.00,76.11,6.44,119.23,1.00,92.21,0.00,7.00,18157.00,6877.00,872.00,3920.00,41.00,6447.00,
2019,11,"DL","Delta Air Lines Inc.","SFO","San Francisco, CA: San Francisco International",1225.00,185.00,34.37,4.51,120.42,0.00,25.70,0.00,1.00,16243.00,4021.00,1942.00,7909.00,0.00,2371.00,
2019,11,"DL","Delta Air Lines Inc.","SJC","San Jose, CA: Norman Y. Mineta San Jose International",393.00,43.00,13.38,1.21,16.55,0.00,11.87,0.00,0.00,2676.00,1011.00,50.00,665.00,0.00,950.00,
2019,11,"DL","Delta Air Lines Inc.","SJU","San Juan, PR: Luis Munoz Marin International",185.00,18.00,7.20,1.00,9.00,0.00,0.80,0.00,0.00,607.00,200.00,128.00,264.00,0.00,15.00,
2019,11,"DL","Delta Air Lines Inc.","SLC","Salt Lake City, UT: Salt Lake City International",3928.00,446.00,134.80,11.99,150.62,0.00,148.58,0.00,1.00,28940.00,10764.00,2471.00,4692.00,0.00,11013.00,
2019,11,"DL","Delta Air Lines Inc.","SMF","Sacramento, CA: Sacramento International",236.00,26.00,8.96,0.00,8.06,0.00,8.98,0.00,0.00,904.00,304.00,0.00,209.00,0.00,391.00,
2019,11,"DL","Delta Air Lines Inc.","SNA","Santa Ana, CA: John Wayne Airport-Orange County",314.00,48.00,17.12,1.08,16.44,0.00,13.36,0.00,0.00,2837.00,771.00,701.00,729.00,0.00,636.00,
2019,11,"DL","Delta Air Lines Inc.","SRQ","Sarasota/Bradenton, FL: Sarasota/Bradenton International",183.00,16.00,7.07,0.00,4.42,0.00,4.51,0.00,0.00,598.00,308.00,0.00,138.00,0.00,152.00,
2019,11,"DL","Delta Air Lines Inc.","STL","St. Louis, MO: St Louis Lambert International",577.00,61.00,19.81,1.06,31.29,0.00,8.85,0.00,0.00,3402.00,1529.00,203.00,1175.00,0.00,495.00,
2019,11,"DL","Delta Air Lines Inc.","STT","Charlotte Amalie, VI: Cyril E King",37.00,1.00,0.00,0.00,1.00,0.00,0.00,0.00,0.00,46.00,0.00,0.00,46.00,0.00,0.00,
2019,11,"DL","Delta Air Lines Inc.","SYR","Syracuse, NY: Syracuse Hancock International",113.00,11.00,5.33,0.00,2.31,0.00,3.36,1.00,0.00,568.00,369.00,0.00,64.00,0.00,135.00,
2019,11,"DL","Delta Air Lines Inc.","TLH","Tallahassee, FL: Tallahassee International",135.00,6.00,3.24,0.00,1.24,0.00,1.52,0.00,0.00,182.00,110.00,0.00,29.00,0.00,43.00,
2019,11,"DL","Delta Air Lines Inc.","TPA","Tampa, FL: Tampa International",896.00,85.00,35.44,1.71,27.60,0.00,20.24,0.00,0.00,3923.00,1806.00,129.00,1048.00,0.00,940.00,
2019,11,"DL","Delta Air Lines Inc.","TRI","Bristol/Johnson City/Kingsport, TN: Tri Cities",29.00,2.00,1.05,0.00,0.08,0.00,0.88,0.00,0.00,69.00,51.00,0.00,4.00,0.00,14.00,
2019,11,"DL","Delta Air Lines Inc.","TUL","Tulsa, OK: Tulsa International",66.00,5.00,3.99,0.00,0.01,0.00,1.00,0.00,0.00,233.00,204.00,0.00,1.00,0.00,28.00,
2019,11,"DL","Delta Air Lines Inc.","TUS","Tucson, AZ: Tucson International",79.00,9.00,1.88,0.00,5.21,0.00,1.91,0.00,0.00,342.00,52.00,0.00,143.00,0.00,147.00,
2019,11,"DL","Delta Air Lines Inc.","TYS","Knoxville, TN: McGhee Tyson",84.00,2.00,1.00,0.00,1.00,0.00,0.00,0.00,0.00,44.00,18.00,0.00,26.00,0.00,0.00,
2019,11,"DL","Delta Air Lines Inc.","VPS","Valparaiso, FL: Eglin AFB Destin Fort Walton Beach",201.00,14.00,5.73,0.00,0.85,0.00,7.41,0.00,0.00,433.00,171.00,0.00,22.00,0.00,240.00,
2019,11,"DL","Delta Air Lines Inc.","XNA","Fayetteville, AR: Northwest Arkansas Regional",32.00,3.00,0.07,0.00,0.12,0.00,2.82,0.00,1.00,154.00,5.00,0.00,5.00,0.00,144.00,
2019,11,"EV","ExpressJet Airlines LLC","ABQ","Albuquerque, NM: Albuquerque International Sunport",30.00,5.00,2.27,0.00,2.15,0.00,0.58,0.00,0.00,181.00,101.00,0.00,62.00,0.00,18.00,
2019,11,"EV","ExpressJet Airlines LLC","AEX","Alexandria, LA: Alexandria International",84.00,11.00,4.74,0.00,4.86,0.00,1.39,0.00,0.00,409.00,158.00,0.00,162.00,0.00,89.00,
2019,11,"EV","ExpressJet Airlines LLC","ALB","Albany, NY: Albany International",1.00,0.00,0.00,0.00,0.00,0.00,0.00,0.00,0.00,0.00,0.00,0.00,0.00,0.00,0.00,
2019,11,"EV","ExpressJet Airlines LLC","AMA","Amarillo, TX: Rick Husband Amarillo International",86.00,12.00,6.02,0.00,5.91,0.00,0.07,0.00,1.00,565.00,410.00,0.00,152.00,0.00,3.00,
2019,11,"EV","ExpressJet Airlines LLC","ATL","Atlanta, GA: Hartsfield-Jackson Atlanta International",77.00,8.00,4.16,0.00,3.33,0.00,0.51,2.00,0.00,405.00,238.00,0.00,147.00,0.00,20.00,
2019,11,"EV","ExpressJet Airlines LLC","AUS","Austin, TX: Austin - Bergstrom International",1.00,0.00,0.00,0.00,0.00,0.00,0.00,0.00,0.00,0.00,0.00,0.00,0.00,0.00,0.00,
2019,11,"EV","ExpressJet Airlines LLC","AVP","Scranton/Wilkes-Barre, PA: Wilkes Barre Scranton International",6.00,1.00,1.00,0.00,0.00,0.00,0.00,0.00,0.00,26.00,26.00,0.00,0.00,0.00,0.00,
2019,11,"EV","ExpressJet Airlines LLC","BGR","Bangor, ME: Bangor International",59.00,17.00,4.02,1.00,0.96,0.00,11.02,0.00,1.00,1052.00,293.00,158.00,39.00,0.00,562.00,
2019,11,"EV","ExpressJet Airlines LLC","BHM","Birmingham, AL: Birmingham-Shuttlesworth International",72.00,7.00,3.74,0.00,3.00,0.00,0.26,0.00,0.00,352.00,273.00,0.00,64.00,0.00,15.00,
2019,11,"EV","ExpressJet Airlines LLC","BNA","Nashville, TN: Nashville International",93.00,17.00,5.46,0.00,7.30,0.00,4.24,1.00,0.00,795.00,227.00,0.00,210.00,0.00,358.00,
2019,11,"EV","ExpressJet Airlines LLC","BRO","Brownsville, TX: Brownsville South Padre Island International",109.00,9.00,1.20,0.00,6.73,0.00,1.07,0.00,0.00,413.00,104.00,0.00,152.00,0.00,157.00,
2019,11,"EV","ExpressJet Airlines LLC","BTR","Baton Rouge, LA: Baton Rouge Metropolitan/Ryan Field",117.00,13.00,5.80,1.00,5.20,0.00,1.00,0.00,0.00,607.00,312.00,87.00,172.00,0.00,36.00,
2019,11,"EV","ExpressJet Airlines LLC","BTV","Burlington, VT: Burlington International",64.00,15.00,5.19,0.00,4.32,0.00,5.49,0.00,0.00,763.00,417.00,0.00,136.00,0.00,210.00,
2019,11,"EV","ExpressJet Airlines LLC","BUF","Buffalo, NY: Buffalo Niagara International",111.00,29.00,12.53,0.00,4.01,0.00,12.45,0.00,1.00,4081.00,2529.00,0.00,169.00,0.00,1383.00,
2019,11,"EV","ExpressJet Airlines LLC","CHS","Charleston, SC: Charleston AFB/International",32.00,6.00,2.00,0.00,1.16,0.00,2.84,0.00,0.00,453.00,224.00,0.00,38.00,0.00,191.00,
2019,11,"EV","ExpressJet Airlines LLC","CLE","Cleveland, OH: Cleveland-Hopkins International",270.00,46.00,17.54,0.00,10.34,0.00,18.12,3.00,0.00,2856.00,1256.00,0.00,526.00,0.00,1074.00,
2019,11,"EV","ExpressJet Airlines LLC","CLL","College Station/Bryan, TX: Easterwood Field",84.00,12.00,4.91,0.77,4.40,0.00,1.92,2.00,0.00,508.00,221.00,104.00,122.00,0.00,61.00,
2019,11,"EV","ExpressJet Airlines LLC","CLT","Charlotte, NC: Charlotte Douglas International",60.00,14.00,1.76,0.25,9.00,0.00,2.99,1.00,0.00,639.00,61.00,18.00,402.00,0.00,158.00,
2019,11,"EV","ExpressJet Airlines LLC","CMH","Columbus, OH: John Glenn Columbus International",31.00,5.00,0.79,0.00,3.23,0.00,0.98,0.00,1.00,177.00,71.00,0.00,81.00,0.00,25.00,
2019,11,"EV","ExpressJet Airlines LLC","COS","Colorado Springs, CO: City of Colorado Springs Municipal",22.00,8.00,1.96,0.99,4.04,0.00,1.01,0.00,0.00,722.00,150.00,391.00,130.00,0.00,51.00,
2019,11,"EV","ExpressJet Airlines LLC","CRP","Corpus Christi, TX: Corpus Christi International",120.00,10.00,3.42,0.00,3.55,0.00,3.04,0.00,0.00,334.00,141.00,0.00,86.00,0.00,107.00,
2019,11,"EV","ExpressJet Airlines LLC","CVG","Cincinnati, OH: Cincinnati/Northern Kentucky International",183.00,36.00,12.54,0.25,11.96,0.00,11.25,2.00,1.00,2100.00,911.00,5.00,561.00,0.00,623.00,
2019,11,"EV","ExpressJet Airlines LLC","DAY","Dayton, OH: James M Cox/Dayton International",7.00,3.00,0.00,0.00,0.67,0.00,2.33,0.00,0.00,170.00,0.00,0.00,54.00,0.00,116.00,
2019,11,"EV","ExpressJet Airlines LLC","DCA","Washington, DC: Ronald Reagan Washington National",129.00,30.00,5.92,0.00,5.78,0.00,18.30,1.00,0.00,1489.00,309.00,0.00,159.00,0.00,1021.00,
2019,11,"EV","ExpressJet Airlines LLC","DFW","Dallas/Fort Worth, TX: Dallas/Fort Worth International",21.00,6.00,0.06,0.00,4.94,0.00,1.00,1.00,0.00,179.00,1.00,0.00,89.00,0.00,89.00,
2019,11,"EV","ExpressJet Airlines LLC","DTW","Detroit, MI: Detroit Metro Wayne County",60.00,12.00,5.80,0.12,4.99,0.00,1.09,2.00,0.00,763.00,495.00,2.00,209.00,0.00,57.00,
2019,11,"EV","ExpressJet Airlines LLC","ECP","Panama City, FL: Northwest Florida Beaches International",60.00,6.00,2.55,0.00,3.45,0.00,0.00,0.00,0.00,210.00,84.00,0.00,126.00,0.00,0.00,
2019,11,"EV","ExpressJet Airlines LLC","ELP","El Paso, TX: El Paso International",39.00,9.00,2.47,0.00,5.25,0.00,1.29,0.00,0.00,280.00,73.00,0.00,147.00,0.00,60.00,
2019,11,"EV","ExpressJet Airlines LLC","EVV","Evansville, IN: Evansville Regional",1.00,0.00,0.00,0.00,0.00,0.00,0.00,0.00,0.00,0.00,0.00,0.00,0.00,0.00,0.00,
2019,11,"EV","ExpressJet Airlines LLC","EWR","Newark, NJ: Newark Liberty International",1333.00,434.00,55.13,5.28,274.27,0.00,99.32,13.00,0.00,40143.00,13832.00,494.00,18457.00,0.00,7360.00,
2019,11,"EV","ExpressJet Airlines LLC","FNT","Flint, MI: Bishop International",4.00,1.00,0.93,0.00,0.00,0.00,0.07,0.00,0.00,106.00,99.00,0.00,0.00,0.00,7.00,
2019,11,"EV","ExpressJet Airlines LLC","FSD","Sioux Falls, SD: Joe Foss Field",1.00,0.00,0.00,0.00,0.00,0.00,0.00,0.00,0.00,0.00,0.00,0.00,0.00,0.00,0.00,
2019,11,"EV","ExpressJet Airlines LLC","GPT","Gulfport/Biloxi, MS: Gulfport-Biloxi International",88.00,11.00,4.34,0.00,6.66,0.00,0.00,0.00,0.00,769.00,618.00,0.00,151.00,0.00,0.00,
2019,11,"EV","ExpressJet Airlines LLC","GRB","Green Bay, WI: Green Bay Austin Straubel International",4.00,1.00,0.00,0.00,0.00,0.00,1.00,0.00,0.00,40.00,0.00,0.00,0.00,0.00,40.00,
2019,11,"EV","ExpressJet Airlines LLC","GRK","Killeen, TX: Robert Gray AAF",68.00,7.00,1.59,0.00,4.01,0.00,1.40,0.00,0.00,254.00,103.00,0.00,109.00,0.00,42.00,
2019,11,"EV","ExpressJet Airlines LLC","GRR","Grand Rapids, MI: Gerald R. Ford International",99.00,24.00,6.90,0.00,8.15,0.00,8.96,2.00,0.00,1321.00,387.00,0.00,270.00,0.00,664.00,
2019,11,"EV","ExpressJet Airlines LLC","GSO","Greensboro/High Point, NC: Piedmont Triad International",29.00,8.00,4.34,0.00,2.42,0.00,1.23,0.00,0.00,307.00,190.00,0.00,75.00,0.00,42.00,
2019,11,"EV","ExpressJet Airlines LLC","GSP","Greer, SC: Greenville-Spartanburg International",79.00,24.00,9.45,0.00,6.94,0.00,7.61,3.00,0.00,2959.00,1970.00,0.00,185.00,0.00,804.00,
2019,11,"EV","ExpressJet Airlines LLC","HRL","Harlingen/San Benito, TX: Valley International",75.00,12.00,3.24,0.00,8.76,0.00,0.00,0.00,0.00,312.00,78.00,0.00,234.00,0.00,0.00,
2019,11,"EV","ExpressJet Airlines LLC","HSV","Huntsville, AL: Huntsville International-Carl T Jones Field",54.00,2.00,1.00,0.00,1.00,0.00,0.00,0.00,0.00,96.00,70.00,0.00,26.00,0.00,0.00,
2019,11,"EV","ExpressJet Airlines LLC","IAH","Houston, TX: George Bush Intercontinental/Houston",3066.00,378.00,49.36,4.87,192.70,0.00,131.07,8.00,3.00,26903.00,8445.00,580.00,9363.00,0.00,8515.00,
2019,11,"EV","ExpressJet Airlines LLC","ICT","Wichita, KS: Wichita Dwight D Eisenhower National",45.00,7.00,2.00,0.00,3.76,0.00,1.24,0.00,0.00,345.00,143.00,0.00,94.00,0.00,108.00,
2019,11,"EV","ExpressJet Airlines LLC","IND","Indianapolis, IN: Indianapolis International",213.00,30.00,15.81,0.00,11.87,0.00,2.33,1.00,0.00,2309.00,1685.00,0.00,456.00,0.00,168.00,
2019,11,"EV","ExpressJet Airlines LLC","JAN","Jackson/Vicksburg, MS: Jackson Medgar Wiley Evers International",158.00,18.00,3.57,0.00,11.95,0.00,2.47,1.00,1.00,594.00,105.00,0.00,430.00,0.00,59.00,
2019,11,"EV","ExpressJet Airlines LLC","JAX","Jacksonville, FL: Jacksonville International",98.00,13.00,6.56,1.00,4.26,0.00,1.18,3.00,0.00,653.00,416.00,24.00,122.00,0.00,91.00,
2019,11,"EV","ExpressJet Airlines LLC","LBB","Lubbock, TX: Lubbock Preston Smith International",55.00,10.00,1.00,1.00,5.02,0.00,2.98,0.00,1.00,1252.00,134.00,666.00,206.00,0.00,246.00,
2019,11,"EV","ExpressJet Airlines LLC","LCH","Lake Charles, LA: Lake Charles Regional",109.00,16.00,4.34,1.93,6.25,0.00,3.47,0.00,0.00,1074.00,154.00,589.00,149.00,0.00,182.00,
2019,11,"EV","ExpressJet Airlines LLC","LEX","Lexington, KY: Blue Grass",40.00,4.00,1.00,0.00,2.11,0.00,0.89,1.00,0.00,252.00,127.00,0.00,47.00,0.00,78.00,
2019,11,"EV","ExpressJet Airlines LLC","LFT","Lafayette, LA: Lafayette Regional Paul Fournet Field",135.00,14.00,3.05,0.91,5.23,0.00,4.80,0.00,0.00,842.00,260.00,161.00,187.00,0.00,234.00,
2019,11,"EV","ExpressJet Airlines LLC","LGA","New York, NY: LaGuardia",184.00,34.00,9.93,0.93,16.82,0.00,6.32,4.00,1.00,1766.00,498.00,126.00,861.00,0.00,281.00,
2019,11,"EV","ExpressJet Airlines LLC","LIT","Little Rock, AR: Bill and Hillary Clinton Nat Adams Field",122.00,18.00,6.54,0.00,7.54,0.00,3.92,1.00,0.00,585.00,210.00,0.00,208.00,0.00,167.00,
2019,11,"EV","ExpressJet Airlines LLC","LNK","Lincoln, NE: Lincoln Airport",17.00,4.00,0.00,0.00,1.99,0.00,2.01,1.00,0.00,113.00,0.00,0.00,53.00,0.00,60.00,
2019,11,"EV","ExpressJet Airlines LLC","LRD","Laredo, TX: Laredo International",84.00,18.00,11.35,0.00,3.23,0.00,3.41,0.00,0.00,1812.00,1474.00,0.00,135.00,0.00,203.00,
2019,11,"EV","ExpressJet Airlines LLC","MAF","Midland/Odessa, TX: Midland International Air and Space Port",9.00,1.00,0.00,0.00,0.00,0.00,1.00,0.00,0.00,20.00,0.00,0.00,0.00,0.00,20.00,
2019,11,"EV","ExpressJet Airlines LLC","MCI","Kansas City, MO: Kansas City International",32.00,1.00,0.00,0.00,1.00,0.00,0.00,0.00,0.00,21.00,0.00,0.00,21.00,0.00,0.00,
2019,11,"EV","ExpressJet Airlines LLC","MEM","Memphis, TN: Memphis International",34.00,7.00,2.96,0.00,3.33,0.00,0.71,0.00,0.00,363.00,237.00,0.00,86.00,0.00,40.00,
2019,11,"EV","ExpressJet Airlines LLC","MFE","Mission/McAllen/Edinburg, TX: McAllen Miller International",43.00,9.00,3.58,0.00,3.79,0.00,1.62,0.00,0.00,382.00,126.00,0.00,149.00,0.00,107.00,
2019,11,"EV","ExpressJet Airlines LLC","MKE","Milwaukee, WI: General Mitchell International",1.00,0.00,0.00,0.00,0.00,0.00,0.00,0.00,0.00,0.00,0.00,0.00,0.00,0.00,0.00,
2019,11,"EV","ExpressJet Airlines LLC","MLU","Monroe, LA: Monroe Regional",55.00,1.00,0.00,0.00,1.00,0.00,0.00,0.00,0.00,24.00,0.00,0.00,24.00,0.00,0.00,
2019,11,"EV","ExpressJet Airlines LLC","MOB","Mobile, AL: Mobile Regional",147.00,11.00,0.83,0.00,8.22,0.00,1.95,0.00,0.00,481.00,20.00,0.00,261.00,0.00,200.00,
2019,11,"EV","ExpressJet Airlines LLC","MSN","Madison, WI: Dane County Regional-Truax Field",59.00,18.00,2.57,0.00,8.41,0.00,7.02,0.00,1.00,1019.00,187.00,0.00,278.00,0.00,554.00,
2019,11,"EV","ExpressJet Airlines LLC","MSP","Minneapolis, MN: Minneapolis-St Paul International",51.00,9.00,2.07,0.00,5.15,0.00,1.78,0.00,0.00,658.00,202.00,0.00,352.00,0.00,104.00,
2019,11,"EV","ExpressJet Airlines LLC","MSY","New Orleans, LA: Louis Armstrong New Orleans International",3.00,2.00,0.00,0.00,2.00,0.00,0.00,0.00,0.00,59.00,0.00,0.00,59.00,0.00,0.00,
2019,11,"EV","ExpressJet Airlines LLC","OKC","Oklahoma City, OK: Will Rogers World",38.00,7.00,0.91,0.00,3.35,0.00,2.74,0.00,0.00,730.00,59.00,0.00,106.00,0.00,565.00,
2019,11,"EV","ExpressJet Airlines LLC","OMA","Omaha, NE: Eppley Airfield",19.00,1.00,1.00,0.00,0.00,0.00,0.00,0.00,0.00,28.00,28.00,0.00,0.00,0.00,0.00,
2019,11,"EV","ExpressJet Airlines LLC","ORD","Chicago, IL: Chicago O'Hare International",1020.00,171.00,27.09,0.00,83.23,0.00,60.68,27.00,2.00,19838.00,8442.00,0.00,6769.00,0.00,4627.00,
2019,11,"EV","ExpressJet Airlines LLC","ORF","Norfolk, VA: Norfolk International",79.00,17.00,6.04,0.00,5.75,0.00,5.20,2.00,0.00,1458.00,978.00,0.00,127.00,0.00,353.00,
2019,11,"EV","ExpressJet Airlines LLC","PHL","Philadelphia, PA: Philadelphia International",22.00,2.00,1.00,0.00,0.00,0.00,1.00,1.00,0.00,74.00,34.00,0.00,0.00,0.00,40.00,
2019,11,"EV","ExpressJet Airlines LLC","PIA","Peoria, IL: General Downing - Peoria International",36.00,4.00,0.60,0.00,2.07,0.00,1.33,1.00,0.00,570.00,178.00,0.00,120.00,0.00,272.00,
2019,11,"EV","ExpressJet Airlines LLC","PIT","Pittsburgh, PA: Pittsburgh International",4.00,0.00,0.00,0.00,0.00,0.00,0.00,0.00,1.00,0.00,0.00,0.00,0.00,0.00,0.00,
2019,11,"EV","ExpressJet Airlines LLC","PNS","Pensacola, FL: Pensacola International",87.00,12.00,2.34,0.00,7.62,0.00,2.05,0.00,0.00,553.00,205.00,0.00,266.00,0.00,82.00,
2019,11,"EV","ExpressJet Airlines LLC","PVD","Providence, RI: Theodore Francis Green State",29.00,2.00,1.00,0.00,0.00,0.00,1.00,1.00,0.00,141.00,100.00,0.00,0.00,0.00,41.00,
2019,11,"EV","ExpressJet Airlines LLC","PWM","Portland, ME: Portland International Jetport",26.00,9.00,3.12,0.00,2.35,0.00,3.52,0.00,0.00,730.00,278.00,0.00,186.00,0.00,266.00,
2019,11,"EV","ExpressJet Airlines LLC","RDU","Raleigh/Durham, NC: Raleigh-Durham International",39.00,6.00,4.43,0.00,0.53,0.00,1.04,0.00,0.00,355.00,203.00,0.00,20.00,0.00,132.00,
2019,11,"EV","ExpressJet Airlines LLC","RIC","Richmond, VA: Richmond International",92.00,20.00,6.24,0.00,3.15,0.00,10.61,0.00,0.00,1965.00,674.00,0.00,902.00,0.00,389.00,
2019,11,"EV","ExpressJet Airlines LLC","ROC","Rochester, NY: Greater Rochester International",90.00,28.00,8.79,0.00,7.47,0.00,11.74,1.00,0.00,1570.00,736.00,0.00,332.00,0.00,502.00,
2019,11,"EV","ExpressJet Airlines LLC","SAT","San Antonio, TX: San Antonio International",5.00,0.00,0.00,0.00,0.00,0.00,0.00,0.00,0.00,0.00,0.00,0.00,0.00,0.00,0.00,
2019,11,"EV","ExpressJet Airlines LLC","SAV","Savannah, GA: Savannah/Hilton Head International",60.00,9.00,4.50,0.00,1.40,0.00,3.10,1.00,0.00,896.00,497.00,0.00,73.00,0.00,326.00,
2019,11,"EV","ExpressJet Airlines LLC","SBN","South Bend, IN: South Bend International",4.00,0.00,0.00,0.00,0.00,0.00,0.00,0.00,0.00,0.00,0.00,0.00,0.00,0.00,0.00,
2019,11,"EV","ExpressJet Airlines LLC","SCE","State College, PA: University Park",4.00,0.00,0.00,0.00,0.00,0.00,0.00,0.00,0.00,0.00,0.00,0.00,0.00,0.00,0.00,
2019,11,"EV","ExpressJet Airlines LLC","SDF","Louisville, KY: Louisville Muhammad Ali International",1.00,0.00,0.00,0.00,0.00,0.00,0.00,0.00,0.00,0.00,0.00,0.00,0.00,0.00,0.00,
2019,11,"EV","ExpressJet Airlines LLC","SGF","Springfield, MO: Springfield-Branson National",47.00,8.00,2.53,0.00,2.39,0.00,3.08,0.00,0.00,390.00,244.00,0.00,42.00,0.00,104.00,
2019,11,"EV","ExpressJet Airlines LLC","SHV","Shreveport, LA: Shreveport Regional",93.00,11.00,4.31,0.00,4.74,0.00,1.95,0.00,0.00,704.00,329.00,0.00,170.00,0.00,205.00,
2019,11,"EV","ExpressJet Airlines LLC","SLC","Salt Lake City, UT: Salt Lake City International",31.00,5.00,1.20,0.00,2.90,0.00,0.90,0.00,0.00,512.00,149.00,0.00,110.00,0.00,253.00,
2019,11,"EV","ExpressJet Airlines LLC","STL","St. Louis, MO: St Louis Lambert International",268.00,50.00,24.17,0.00,14.40,0.00,11.44,1.00,0.00,3200.00,1791.00,0.00,697.00,0.00,712.00,
2019,11,"EV","ExpressJet Airlines LLC","SYR","Syracuse, NY: Syracuse Hancock International",112.00,24.00,9.63,0.00,4.30,0.00,10.07,0.00,0.00,1691.00,988.00,0.00,193.00,0.00,510.00,
2019,11,"EV","ExpressJet Airlines LLC","TUL","Tulsa, OK: Tulsa International",131.00,15.00,6.04,0.00,6.93,0.00,2.03,1.00,0.00,1671.00,1353.00,0.00,236.00,0.00,82.00,
2019,11,"EV","ExpressJet Airlines LLC","TUS","Tucson, AZ: Tucson International",2.00,0.00,0.00,0.00,0.00,0.00,0.00,0.00,0.00,0.00,0.00,0.00,0.00,0.00,0.00,
2019,11,"EV","ExpressJet Airlines LLC","TYS","Knoxville, TN: McGhee Tyson",137.00,21.00,8.18,0.00,6.07,0.00,6.74,0.00,1.00,2830.00,2420.00,0.00,197.00,0.00,213.00,
2019,11,"EV","ExpressJet Airlines LLC","VPS","Valparaiso, FL: Eglin AFB Destin Fort Walton Beach",59.00,6.00,0.94,0.00,4.89,0.00,0.17,0.00,1.00,275.00,44.00,0.00,220.00,0.00,11.00,
2019,11,"EV","ExpressJet Airlines LLC","XNA","Fayetteville, AR: Northwest Arkansas Regional",21.00,3.00,2.00,0.00,1.00,0.00,0.00,0.00,1.00,126.00,100.00,0.00,26.00,0.00,0.00,
2019,11,"F9","Frontier Airlines Inc.","ABQ","Albuquerque, NM: Albuquerque International Sunport",15.00,3.00,1.00,0.00,0.41,0.00,1.59,0.00,0.00,251.00,58.00,0.00,35.00,0.00,158.00,
2019,11,"F9","Frontier Airlines Inc.","ALB","Albany, NY: Albany International",32.00,5.00,2.31,0.00,0.10,0.00,2.59,0.00,0.00,335.00,166.00,0.00,6.00,0.00,163.00,
2019,11,"F9","Frontier Airlines Inc.","ATL","Atlanta, GA: Hartsfield-Jackson Atlanta International",353.00,69.00,26.60,0.00,20.11,0.00,22.29,1.00,0.00,3668.00,1473.00,0.00,761.00,0.00,1434.00,
2019,11,"F9","Frontier Airlines Inc.","AUS","Austin, TX: Austin - Bergstrom International",229.00,48.00,14.47,0.00,10.66,0.00,22.87,0.00,0.00,4524.00,913.00,0.00,446.00,0.00,3165.00,
2019,11,"F9","Frontier Airlines Inc.","BDL","Hartford, CT: Bradley International",42.00,13.00,4.67,0.00,1.11,0.00,7.22,0.00,0.00,924.00,322.00,0.00,42.00,0.00,560.00,
2019,11,"F9","Frontier Airlines Inc.","BFM","Mobile, AL: Mobile Downtown",16.00,2.00,0.07,0.00,1.93,0.00,0.00,0.00,0.00,96.00,5.00,0.00,91.00,0.00,0.00,
2019,11,"F9","Frontier Airlines Inc.","BHM","Birmingham, AL: Birmingham-Shuttlesworth International",6.00,1.00,0.00,0.00,0.00,0.00,1.00,0.00,0.00,37.00,0.00,0.00,0.00,0.00,37.00,
2019,11,"F9","Frontier Airlines Inc.","BIL","Billings, MT: Billings Logan International",12.00,3.00,1.41,0.00,1.00,0.00,0.59,0.00,0.00,90.00,39.00,0.00,24.00,0.00,27.00,
2019,11,"F9","Frontier Airlines Inc.","BIS","Bismarck/Mandan, ND: Bismarck Municipal",5.00,0.00,0.00,0.00,0.00,0.00,0.00,0.00,0.00,0.00,0.00,0.00,0.00,0.00,0.00,
2019,11,"F9","Frontier Airlines Inc.","BKG","Branson, MO: Branson Airport",16.00,5.00,1.18,0.00,1.93,0.00,1.89,0.00,1.00,338.00,60.00,0.00,92.00,0.00,186.00,
2019,11,"F9","Frontier Airlines Inc.","BMI","Bloomington/Normal, IL: Central Il Regional Airport at Bloomington",15.00,3.00,0.21,0.00,0.88,0.00,1.91,0.00,0.00,156.00,6.00,0.00,30.00,0.00,120.00,
2019,11,"F9","Frontier Airlines Inc.","BNA","Nashville, TN: Nashville International",91.00,15.00,7.20,0.00,2.01,0.00,5.79,1.00,0.00,970.00,419.00,0.00,82.00,0.00,469.00,
2019,11,"F9","Frontier Airlines Inc.","BOI","Boise, ID: Boise Air Terminal",4.00,1.00,0.00,0.00,1.00,0.00,0.00,0.00,0.00,19.00,0.00,0.00,19.00,0.00,0.00,
2019,11,"F9","Frontier Airlines Inc.","BOS","Boston, MA: Logan International",72.00,8.00,4.11,0.59,0.62,0.00,2.69,1.00,0.00,876.00,415.00,61.00,86.00,0.00,314.00,
2019,11,"F9","Frontier Airlines Inc.","BTV","Burlington, VT: Burlington International",14.00,5.00,1.59,0.00,2.41,0.00,1.00,0.00,0.00,295.00,140.00,0.00,66.00,0.00,89.00,
2019,11,"F9","Frontier Airlines Inc.","BUF","Buffalo, NY: Buffalo Niagara International",66.00,11.00,1.06,0.49,1.58,0.00,7.87,0.00,0.00,1263.00,155.00,32.00,57.00,0.00,1019.00,
